gfx906_64.cd.updb.txt
3-224-224-7x7-64-112-112-32-3x3-2x2-1x1-0-NCHW-FP32-F=ConvOclDirectFwd:16,8,16,16,1,2,8,1,2
64-55-55-1x1-256-55-55-32-0x0-1x1-1x1-0-NCHW-FP32-F=ConvAsm1x1U:1,16,1,64,4,2,1,4
64-55-55-1x1-64-55-55-32-0x0-1x1-1x1-0-NCHW-FP32-F=ConvAsm1x1U:1,16,1,64,4,2,1,4
256-55-55-1x1-64-55-55-32-0x0-1x1-1x1-0-NCHW-FP32-F=ConvAsm1x1U:1,16,1,64,4,2,1,4
256-55-55-1x1-512-28-28-32-0x0-2x2-1x1-0-NCHW-FP32-F=ConvAsm1x1U:1,16,1,16,4,2,1,4
256-55-55-1x1-128-28-28-32-0x0-2x2-1x1-0-NCHW-FP32-F=ConvAsm1x1U:1,16,1,16,4,2,2,2
128-28-28-1x1-512-28-28-32-0x0-1x1-1x1-0-NCHW-FP32-F=ConvAsm1x1U:1,16,1,32,4,2,2,2
512-28-28-1x1-128-28-28-32-0x0-1x1-1x1-0-NCHW-FP32-F=ConvAsm1x1U:1,16,1,32,4,2,2,2
512-28-28-1x1-1024-14-14-32-0x0-2x2-1x1-0-NCHW-FP32-F=ConvAsm1x1U:4,8,7,32,2,4,1,4
512-28-28-1x1-256-14-14-32-0x0-2x2-1x1-0-NCHW-FP32-F=ConvAsm1x1U:4,8,7,32,1,2,1,8
256-14-14-1x1-1024-14-14-32-0x0-1x1-1x1-0-NCHW-FP32-F=ConvAsm1x1U:2,8,2,64,4,2,1,4
1024-14-14-1x1-256-14-14-32-0x0-1x1-1x1-0-NCHW-FP32-F=ConvAsm1x1U:4,8,7,32,1,4,1,8
1024-14-14-1x1-2048-7-7-32-0x0-2x2-1x1-0-NCHW-FP32-F=ConvAsm1x1U:4,8,4,16,4,2,1,4
1024-14-14-1x1-512-7-7-32-0x0-2x2-1x1-0-NCHW-FP32-F=ConvAsm1x1U:4,8,4,16,1,4,1,8
512-7-7-1x1-2048-7-7-32-0x0-1x1-1x1-0-NCHW-FP32-F=ConvAsm1x1U:2,8,2,32,2,4,2,4
2048-7-7-1x1-512-7-7-32-0x0-1x1-1x1-0-NCHW-FP32-F=ConvAsm1x1U:4,8,4,16,2,4,1,4
2048-7-7-1x1-512-7-7-32-0x0-1x1-1x1-0-NCHW-FP32-B=ConvAsm1x1U:2,16,2,32,1,2,4,2
2048-7-7-1x1-512-7-7-32-0x0-1x1-1x1-0-NCHW-FP32-W=ConvAsmBwdWrW1x1:1,16,4,4,8,1,1,4,0,1
512-7-7-1x1-2048-7-7-32-0x0-1x1-1x1-0-NCHW-FP32-B=ConvAsm1x1U:1,16,1,64,2,2,2,2
512-7-7-1x1-2048-7-7-32-0x0-1x1-1x1-0-NCHW-FP32-W=ConvAsmBwdWrW1x1:1,16,4,4,8,1,1,4,0,1
2048-7-7-1x1-1024-14-14-32-0x0-2x2-1x1-0-NCHW-FP32-B=ConvAsm1x1U:2,16,2,32,1,2,2,2
2048-7-7-1x1-1024-14-14-32-0x0-2x2-1x1-0-NCHW-FP32-W=ConvAsmBwdWrW1x1:1,16,2,4,8,1,1,4,0,2
512-7-7-1x1-1024-14-14-32-0x0-2x2-1x1-0-NCHW-FP32-B=ConvAsm1x1U:1,16,1,64,2,2,2,4
512-7-7-1x1-1024-14-14-32-0x0-2x2-1x1-0-NCHW-FP32-W=ConvAsmBwdWrW1x1:1,16,4,4,8,1,1,2,0,2
1024-14-14-1x1-256-14-14-32-0x0-1x1-1x1-0-NCHW-FP32-B=ConvAsm1x1U:1,32,1,32,2,1,4,1
1024-14-14-1x1-256-14-14-32-0x0-1x1-1x1-0-NCHW-FP32-W=ConvAsmBwdWrW1x1:1,16,4,4,8,1,2,4,0,1
256-14-14-1x1-1024-14-14-32-0x0-1x1-1x1-0-NCHW-FP32-B=ConvAsm1x1U:1,16,1,32,2,2,1,8
256-14-14-1x1-1024-14-14-32-0x0-1x1-1x1-0-NCHW-FP32-W=ConvAsmBwdWrW1x1:1,16,2,4,8,1,1,4,0,2
1024-14-14-1x1-512-28-28-32-0x0-2x2-1x1-0-NCHW-FP32-B=ConvAsm1x1U:1,32,1,32,2,1,2,2
1024-14-14-1x1-512-28-28-32-0x0-2x2-1x1-0-NCHW-FP32-W=ConvAsmBwdWrW1x1:1,16,4,8,4,1,1,4,0,2
256-14-14-1x1-512-28-28-32-0x0-2x2-1x1-0-NCHW-FP32-B=ConvAsm1x1U:1,16,1,32,2,2,1,4
256-14-14-1x1-512-28-28-32-0x0-2x2-1x1-0-NCHW-FP32-W=ConvAsmBwdWrW1x1:1,16,2,8,2,1,1,4,0,2
512-28-28-1x1-128-28-28-32-0x0-1x1-1x1-0-NCHW-FP32-B=ConvAsm1x1U:1,16,1,32,2,2,2,2
512-28-28-1x1-128-28-28-32-0x0-1x1-1x1-0-NCHW-FP32-W=ConvAsmBwdWrW1x1:1,16,2,8,4,1,4,4,0,2
128-28-28-1x1-512-28-28-32-0x0-1x1-1x1-0-NCHW-FP32-B=ConvAsm1x1U:1,16,1,32,2,2,1,4
128-28-28-1x1-512-28-28-32-0x0-1x1-1x1-0-NCHW-FP32-W=ConvAsmBwdWrW1x1:1,16,2,8,4,1,4,4,0,2
512-28-28-1x1-256-55-55-32-0x0-2x2-1x1-0-NCHW-FP32-B=ConvAsm1x1U:1,16,1,32,2,2,2,2
512-28-28-1x1-256-55-55-32-0x0-2x2-1x1-0-NCHW-FP32-W=ConvAsmBwdWrW1x1:2,8,4,8,4,1,2,4,0,2
128-28-28-1x1-256-55-55-32-0x0-2x2-1x1-0-NCHW-FP32-B=ConvAsm1x1U:1,16,1,32,2,2,1,4
128-28-28-1x1-256-55-55-32-0x0-2x2-1x1-0-NCHW-FP32-W=ConvAsmBwdWrW1x1:1,16,2,8,2,1,4,4,0,3
256-55-55-1x1-64-55-55-32-0x0-1x1-1x1-0-NCHW-FP32-B=ConvAsm1x1U:1,16,1,64,2,2,1,4
256-55-55-1x1-64-55-55-32-0x0-1x1-1x1-0-NCHW-FP32-W=ConvAsmBwdWrW1x1:2,8,2,8,2,1,4,2,0,3
64-55-55-1x1-256-55-55-32-0x0-1x1-1x1-0-NCHW-FP32-B=ConvAsm1x1U:1,32,1,64,1,1,1,4
64-55-55-1x1-256-55-55-32-0x0-1x1-1x1-0-NCHW-FP32-W=ConvAsmBwdWrW1x1:2,8,2,8,2,1,4,2,0,3
64-55-55-1x1-64-55-55-32-0x0-1x1-1x1-0-NCHW-FP32-B=ConvAsm1x1U:1,16,1,64,1,2,1,4
64-55-55-1x1-64-55-55-32-0x0-1x1-1x1-0-NCHW-FP32-W=ConvAsmBwdWrW1x1:4,4,4,4,2,1,4,4,0,1
3-224-224-3x3-64-224-224-32-1x1-1x1-1x1-0-NCHW-FP32-F=ConvOclDirectFwd:8,32,32,32,4,1,4,1,2
512-14-14-3x3-512-14-14-32-1x1-1x1-1x1-0-NCHW-FP32-W=ConvAsmBwdWrW3x3:0,1,8,4,4,1
512-28-28-3x3-512-28-28-32-1x1-1x1-1x1-0-NCHW-FP32-W=ConvAsmBwdWrW3x3:0,1,8,4,3,1
512-28-28-3x3-256-28-28-32-1x1-1x1-1x1-0-NCHW-FP32-W=ConvAsmBwdWrW3x3:0,0,8,4,8,1
256-56-56-3x3-256-56-56-32-1x1-1x1-1x1-0-NCHW-FP32-W=ConvAsmBwdWrW3x3:0,1,16,4,2,1
256-56-56-3x3-128-56-56-32-1x1-1x1-1x1-0-NCHW-FP32-W=ConvAsmBwdWrW3x3:0,0,16,4,2,1
128-112-112-3x3-128-112-112-32-1x1-1x1-1x1-0-NCHW-FP32-W=ConvAsmBwdWrW3x3:0,0,16,4,3,4
128-112-112-3x3-64-112-112-32-1x1-1x1-1x1-0-NCHW-FP32-W=ConvAsmBwdWrW3x3:0,0,16,4,3,4
64-224-224-3x3-64-224-224-32-1x1-1x1-1x1-0-NCHW-FP32-W=ConvAsmBwdWrW3x3:0,0,16,4,2,2
64-224-224-3x3-3-224-224-32-1x1-1x1-1x1-0-NCHW-FP32-W=ConvAsmBwdWrW3x3:0,1,16,1,2,4
3-224-224-3x3-64-224-224-28-1x1-1x1-1x1-0-NCHW-FP32-F=ConvOclDirectFwd:8,32,32,32,4,1,4,1,2